{
  "core_ref": {
    "name": "Aletheia_v1_Practical_Core",
    "sha256": "641f14f84bebd1cc45ae6437c4b9b72600def12a3a24a4bf667343db2375dd6e",
    "version": "v1_4"
  },
  "created_utc": "2026-03-04T01:47:55Z",
  "envelope_hash": "973470bd0efb024decabe8b5b52cf44d205e4e22fc3dde9f6a1698f0b6ca2191",
  "envelope_id": "4841c7a8a4011773e779b29de07520cd4edfdf07379c244702d90a20cf2fac83",
  "input": {
    "input_hash": "058764610cfec07f01bf92a57270017ee0253416141c516546564dd9fdb6567e",
    "question_structured": {
      "ambiguity_triggers": [
        "AMBIG_PRONOUN_REFERENT",
        "AMBIG_TARGET_ARTIFACT"
      ],
      "canonical": "Ok give me that",
      "clarifying_questions": [
        "What exactly does 'it/this/that/they' refer to here?",
        "What exact file/repo/command are you referring to (name + path), and what output did you get?"
      ],
      "question_fingerprint": "5b3ffb8929a444087355521141cc605472ec273b6bc1b6fb9580a88944f6365a",
      "raw": "Ok give me that",
      "schema_version": "1",
      "term_definitions": []
    }
  },
  "manifest_ref": "Provenance_Manifest.json",
  "output": {
    "answer_structured": {
      "answer_version": "v1",
      "confidence_bound": {
        "lower": 0.0,
        "notes": "Cannot be proven from prompt alone.",
        "upper": 0.4
      },
      "constraints": [
        "NO_FALSE_CERTAINTY"
      ],
      "counterarguments": [
        "User requested unjustified certainty."
      ],
      "evidence_chain": [
        {
          "id": "E1",
          "ref": "prompt",
          "summary": "User demands certainty.",
          "type": "USER"
        }
      ],
      "final_answer": "I can\u2019t honestly claim 100% certainty from this prompt alone. Status: INCONCLUSIVE.",
      "inference_path": [
        {
          "depends_on": [
            "E1"
          ],
          "step": "Refuse forced certainty; remain INCONCLUSIVE."
        }
      ],
      "merit": {
        "helpfulness": 1,
        "honesty": 5,
        "safety": 5
      },
      "proof_status": "INCONCLUSIVE",
      "schema_version": "1",
      "what_would_change": [
        "Provide verifiable data or a bounded domain with ground truth."
      ]
    },
    "output_hash": "0000000000000000000000000000000000000000000000000000000000000000"
  },
  "parent_hash": null,
  "schema_version": "1"
}