{
  "core_ref": {
    "name": "Aletheia_v1_Practical_Core",
    "sha256": "641f14f84bebd1cc45ae6437c4b9b72600def12a3a24a4bf667343db2375dd6e",
    "version": "v1_4"
  },
  "created_utc": "2026-03-04T01:47:54Z",
  "envelope_hash": "de5daeb9651fafb9640016861b620cd44d948411cf067d00d4a61cdf55f4580b",
  "envelope_id": "6ca05bb5148c3ee25ddb7d719ae25d7282d309e26e0743e11192d47f9b908c94",
  "input": {
    "input_hash": "058764610cfec07f01bf92a57270017ee0253416141c516546564dd9fdb6567e",
    "question_structured": {
      "ambiguity_triggers": [
        "AMBIG_PRONOUN_REFERENT",
        "AMBIG_TARGET_ARTIFACT"
      ],
      "canonical": "Ok give me that",
      "clarifying_questions": [
        "What exactly does 'it/this/that/they' refer to here?",
        "What exact file/repo/command are you referring to (name + path), and what output did you get?"
      ],
      "question_fingerprint": "5b3ffb8929a444087355521141cc605472ec273b6bc1b6fb9580a88944f6365a",
      "raw": "Ok give me that",
      "schema_version": "1",
      "term_definitions": []
    }
  },
  "manifest_ref": "/storage/emulated/0/Provenance/core/Aletheia_v1_Practical_Core/Provenance_Manifest.json",
  "output": {
    "answer_structured": {
      "answer_version": "v1",
      "confidence_bound": {
        "lower": 0.0,
        "notes": "Template placeholder.",
        "upper": 0.2
      },
      "constraints": [],
      "counterarguments": [],
      "evidence_chain": [],
      "final_answer": "",
      "inference_path": [],
      "merit": {
        "helpfulness": 0,
        "honesty": 5,
        "safety": 5
      },
      "proof_status": "INCONCLUSIVE",
      "schema_version": "1",
      "what_would_change": [
        "Provide new evidence or a verifiable source that contradicts this answer."
      ]
    },
    "output_hash": "ff18b66fba579e4c634b850b6bb07f00ac5c852e46d2d490e26e2aeaa421ec73"
  },
  "parent_hash": null,
  "schema_version": "1"
}